{
  "$id": "E-BRq9StLuC9DxGgiFiy2XND0fFgzyn8cjptlcdvGEFY",
  "$schema": "http://json-schema.org/draft-07/schema#",
  "title": "Legal Entity vLEI Credential",
  "description": "A vLEI Credential issued by a Qualified vLEI issuer to a Legal Entity",
  "properties": {
    "v": {
      "type": "string"
    },
    "i": {
      "type": "string"
    },
    "ti": {
      "type": "string"
    },
    "x": {
      "description": "schema block",
      "type": "string"
    },
    "d": {
      "description": "data block",
      "properties": {
        "i": {
          "type": "string"
        },
        "si": {
          "type": "string"
        },
        "issuanceDate": {
          "format": "date-time",
          "type": "string"
        },
        "credentialStatus": {
          "type": "string"
        },
        "LEI": {
          "type": "string"
        },
        "type": {
          "contains": {
            "const": "LegalEntityvLEICredential"
          },
          "type": "array"
        }
      },
      "additionalProperties": false,
      "required": [
        "i",
        "issuanceDate",
        "credentialStatus",
        "LEI",
        "type"
      ],
      "type": "object"
    },
    "s": {
      "contains": {
        "type": "object"
      },
      "description": "source block",
      "items": {
        "properties": {
          "qualifiedvLEIIssuervLEICredential": {
            "type": "string"
          }
        },
        "additionalProperties": false,
        "required": [
          "qualifiedvLEIIssuervLEICredential"
        ],
        "type": "object"
      },
      "maxItems": 1,
      "minItems": 1,
      "type": "array"
    }
  },
  "additionalProperties": false,
  "required": [
    "i",
    "s",
    "d"
  ],
  "type": "object"
}