{
  "v": "ACDC10JSON00011c_",
  "i": "EBdXt3gIXOf2BBWNHdSXCJnFJL5OuQPyM5K0neuniccM",
  "ti": "did:keri:EmkPreYpZfFk66jpf3uFv7vklXKhzBrAqjsKAn2EDIPM",
  "x": "E46jrVPTzlSkUPqGGeIZ8a8FWS7a6s4reAXRZOkogZ2A",
  "d": {
    "i": "EgveY4-9XgOcLxUderzwLIr9Bf7V_NHwY1lkFrn9y2PY",
    "si": "did:keri:EQzFVaMasUf4cZZBKA0pUbRc9T8yUXRFLyM1JDASYqAA",
    "issuanceDate": "2021-06-09T17:35:54.169967+00:00",
    "credentialStatus": "did:keri:EymRy7xMwsxUelUauaXtMxTfPAMPAI6FkekwlOjkggt",
    "LEI": "254900OPPU84GM83MG36",
    "type": [
      "VerifiableCredential",
      "LegalEntityvLEICredential"
    ]
  },
  "s": [
    {
      "qualifiedvLEIIssuervLEICredential": "EBDmgKOAEwnMGsofWg2m0l63J1awfJafqJyCzTnVkdSw"
    }
  ]
}
